{
  "$schema": "http://json-schema.org/draft-07/schema#",
  "$id": "https://dai-harness.local/schemas/docs-manifest.schema.json",
  "title": "DAI Harness Docs Manifest",
  "type": "object",
  "additionalProperties": false,
  "required": ["schema_version", "project", "sources", "privacy"],
  "properties": {
    "schema_version": {
      "const": 1
    },
    "project": {
      "type": "object",
      "additionalProperties": false,
      "required": ["id", "title"],
      "properties": {
        "id": {
          "type": "string",
          "pattern": "^[a-z0-9]+(?:-[a-z0-9]+)*$"
        },
        "title": {
          "type": "string",
          "minLength": 1
        }
      }
    },
    "sources": {
      "type": "array",
      "minItems": 1,
      "items": {
        "$ref": "#/definitions/source"
      }
    },
    "project_docs": {
      "type": "object",
      "additionalProperties": false,
      "required": ["schema_version", "state"],
      "properties": {
        "schema_version": {
          "const": 1
        },
        "state": {
          "$ref": "#/definitions/relativePath"
        },
        "max_stale_days": {
          "type": "integer",
          "minimum": 1,
          "maximum": 365
        }
      }
    },
    "truth": {
      "type": "array",
      "uniqueItems": true,
      "items": {
        "$ref": "#/definitions/relativePath"
      },
      "default": []
    },
    "adapters": {
      "type": "object",
      "additionalProperties": false,
      "properties": {
        "git": {
          "type": "boolean",
          "default": true
        },
        "dai_memory": {
          "type": "boolean",
          "default": false,
          "description": "Report the freshness of the DAI memory layer's code index (.memory/meta.json)."
        },
        "gitnexus": {
          "type": "boolean",
          "default": false,
          "deprecated": true,
          "description": "Former name of dai_memory, honoured when dai_memory is absent."
        },
        "evidence_summary": {
          "type": "boolean",
          "default": false
        }
      }
    },
    "privacy": {
      "type": "object",
      "additionalProperties": false,
      "required": ["mode"],
      "properties": {
        "mode": {
          "const": "allowlist"
        },
        "allow": {
          "type": "array",
          "uniqueItems": true,
          "items": {
            "$ref": "#/definitions/relativePath"
          },
          "default": []
        },
        "exclude": {
          "type": "array",
          "uniqueItems": true,
          "items": {
            "$ref": "#/definitions/relativePath"
          },
          "default": []
        }
      }
    }
  },
  "definitions": {
    "relativePath": {
      "type": "string",
      "minLength": 1,
      "pattern": "^(?!/)(?![A-Za-z]:)(?!.*\\\\)(?!.*(?:^|/)\\.\\.(?:/|$)).+$"
    },
    "source": {
      "type": "object",
      "additionalProperties": false,
      "required": ["path", "type"],
      "properties": {
        "path": {
          "$ref": "#/definitions/relativePath"
        },
        "type": {
          "type": "string",
          "enum": [
            "documentation",
            "overview",
            "architecture",
            "product",
            "testing",
            "operations",
            "assets",
            "metadata"
          ]
        },
        "include": {
          "type": "array",
          "uniqueItems": true,
          "items": {
            "type": "string",
            "minLength": 1
          },
          "default": []
        },
        "exclude": {
          "type": "array",
          "uniqueItems": true,
          "items": {
            "type": "string",
            "minLength": 1
          },
          "default": []
        }
      }
    }
  }
}
